<?xml version="1.0" encoding="UTF-8"?>
<!DOCTYPE list SYSTEM "option_data.dtd">
<list>
	<option_data id="36600">
		<!--P. Evasion +1.7-->
	</option_data>
	<option_data id="36601">
		<!--P. Evasion +1.8-->
	</option_data>
	<option_data id="36602">
		<!--P. Evasion +2.0-->
	</option_data>
	<option_data id="36603">
		<!--P. Evasion +3.0-->
	</option_data>
	<option_data id="36604">
		<!--M. Evasion +1.0-->
	</option_data>
	<option_data id="36605">
		<!--M. Evasion +1.0-->
	</option_data>
	<option_data id="36606">
		<!--M. Evasion +1.0-->
	</option_data>
	<option_data id="36607">
		<!--M. Evasion +1.0-->
	</option_data>
	<option_data id="36608">
		<!--M. Evasion +1.0-->
	</option_data>
	<option_data id="36609">
		<!--M. Evasion +1.0-->
	</option_data>
	<option_data id="36610">
		<!--M. Evasion +1.0-->
	</option_data>
	<option_data id="36611">
		<!--M. Evasion +1.1-->
	</option_data>
	<option_data id="36612">
		<!--M. Evasion +1.1-->
	</option_data>
	<option_data id="36613">
		<!--M. Evasion +1.2-->
	</option_data>
	<option_data id="36614">
		<!--M. Evasion +1.2-->
	</option_data>
	<option_data id="36615">
		<!--M. Evasion +1.2-->
	</option_data>
	<option_data id="36616">
		<!--M. Evasion +1.2-->
	</option_data>
	<option_data id="36617">
		<!--M. Evasion +1.3-->
	</option_data>
	<option_data id="36618">
		<!--M. Evasion +1.4-->
	</option_data>
	<option_data id="36619">
		<!--M. Evasion +1.5-->
	</option_data>
	<option_data id="36620">
		<!--M. Evasion +1.7-->
	</option_data>
	<option_data id="36621">
		<!--M. Evasion +1.8-->
	</option_data>
	<option_data id="36622">
		<!--M. Evasion +2.0-->
	</option_data>
	<option_data id="36623">
		<!--M. Evasion +3.0-->
	</option_data>
	<option_data id="36624">
		<!--M. Evasion +1.0-->
	</option_data>
	<option_data id="36625">
		<!--M. Evasion +1.0-->
	</option_data>
	<option_data id="36626">
		<!--M. Evasion +1.0-->
	</option_data>
	<option_data id="36627">
		<!--M. Evasion +1.0-->
	</option_data>
	<option_data id="36628">
		<!--M. Evasion +1.0-->
	</option_data>
	<option_data id="36629">
		<!--M. Evasion +1.0-->
	</option_data>
	<option_data id="36630">
		<!--M. Evasion +1.0-->
	</option_data>
	<option_data id="36631">
		<!--M. Evasion +1.1-->
	</option_data>
	<option_data id="36632">
		<!--M. Evasion +1.1-->
	</option_data>
	<option_data id="36633">
		<!--M. Evasion +1.2-->
	</option_data>
	<option_data id="36634">
		<!--M. Evasion +1.2-->
	</option_data>
	<option_data id="36635">
		<!--M. Evasion +1.2-->
	</option_data>
	<option_data id="36636">
		<!--M. Evasion +1.2-->
	</option_data>
	<option_data id="36637">
		<!--M. Evasion +1.3-->
	</option_data>
	<option_data id="36638">
		<!--M. Evasion +1.4-->
	</option_data>
	<option_data id="36639">
		<!--M. Evasion +1.5-->
	</option_data>
	<option_data id="36640">
		<!--M. Evasion +1.7-->
	</option_data>
	<option_data id="36641">
		<!--M. Evasion +1.8-->
	</option_data>
	<option_data id="36642">
		<!--M. Evasion +2.0-->
	</option_data>
	<option_data id="36643">
		<!--M. Evasion +3.0-->
	</option_data>
	<option_data id="36644">
		<!--M. Evasion +1.0-->
	</option_data>
	<option_data id="36645">
		<!--M. Evasion +1.0-->
	</option_data>
	<option_data id="36646">
		<!--M. Evasion +1.0-->
	</option_data>
	<option_data id="36647">
		<!--M. Evasion +1.0-->
	</option_data>
	<option_data id="36648">
		<!--M. Evasion +1.0-->
	</option_data>
	<option_data id="36649">
		<!--M. Evasion +1.0-->
	</option_data>
	<option_data id="36650">
		<!--M. Evasion +1.0-->
	</option_data>
	<option_data id="36651">
		<!--M. Evasion +1.1-->
	</option_data>
	<option_data id="36652">
		<!--M. Evasion +1.1-->
	</option_data>
	<option_data id="36653">
		<!--M. Evasion +1.2-->
	</option_data>
	<option_data id="36654">
		<!--M. Evasion +1.2-->
	</option_data>
	<option_data id="36655">
		<!--M. Evasion +1.2-->
	</option_data>
	<option_data id="36656">
		<!--M. Evasion +1.2-->
	</option_data>
	<option_data id="36657">
		<!--M. Evasion +1.3-->
	</option_data>
	<option_data id="36658">
		<!--M. Evasion +1.4-->
	</option_data>
	<option_data id="36659">
		<!--M. Evasion +1.5-->
	</option_data>
	<option_data id="36660">
		<!--M. Evasion +1.7-->
	</option_data>
	<option_data id="36661">
		<!--M. Evasion +1.8-->
	</option_data>
	<option_data id="36662">
		<!--M. Evasion +2.0-->
	</option_data>
	<option_data id="36663">
		<!--M. Evasion +3.0-->
	</option_data>
	<option_data id="36664">
		<!--Received damage -1%-->
	</option_data>
	<option_data id="36665">
		<!--Received damage -1%-->
	</option_data>
	<option_data id="36666">
		<!--Received damage -1%-->
	</option_data>
	<option_data id="36667">
		<!--Received damage -1%-->
	</option_data>
	<option_data id="36668">
		<!--Received damage -1%-->
	</option_data>
	<option_data id="36669">
		<!--Received damage -1%-->
	</option_data>
	<option_data id="36670">
		<!--Received damage -1%-->
	</option_data>
	<option_data id="36671">
		<!--Received damage -1%-->
	</option_data>
	<option_data id="36672">
		<!--Received damage -1%-->
	</option_data>
	<option_data id="36673">
		<!--Received damage -1%-->
	</option_data>
	<option_data id="36674">
		<!--Received damage -1%-->
	</option_data>
	<option_data id="36675">
		<!--Received damage -1%-->
	</option_data>
	<option_data id="36676">
		<!--Received damage -1%-->
	</option_data>
	<option_data id="36677">
		<!--Received damage -1%-->
	</option_data>
	<option_data id="36678">
		<!--Received damage -1%-->
	</option_data>
	<option_data id="36679">
		<!--Received damage -1%-->
	</option_data>
	<option_data id="36680">
		<!--Received damage -2%-->
	</option_data>
	<option_data id="36681">
		<!--Received damage -2%-->
	</option_data>
	<option_data id="36682">
		<!--Received damage -2%-->
	</option_data>
	<option_data id="36683">
		<!--Received damage -3%-->
	</option_data>
	<option_data id="36684">
		<!--Received damage -1%-->
	</option_data>
	<option_data id="36685">
		<!--Received damage -1%-->
	</option_data>
	<option_data id="36686">
		<!--Received damage -1%-->
	</option_data>
	<option_data id="36687">
		<!--Received damage -1%-->
	</option_data>
	<option_data id="36688">
		<!--Received damage -1%-->
	</option_data>
	<option_data id="36689">
		<!--Received damage -1%-->
	</option_data>
	<option_data id="36690">
		<!--Received damage -1%-->
	</option_data>
	<option_data id="36691">
		<!--Received damage -1%-->
	</option_data>
	<option_data id="36692">
		<!--Received damage -1%-->
	</option_data>
	<option_data id="36693">
		<!--Received damage -1%-->
	</option_data>
	<option_data id="36694">
		<!--Received damage -1%-->
	</option_data>
	<option_data id="36695">
		<!--Received damage -1%-->
	</option_data>
	<option_data id="36696">
		<!--Received damage -1%-->
	</option_data>
	<option_data id="36697">
		<!--Received damage -1%-->
	</option_data>
	<option_data id="36698">
		<!--Received damage -1%-->
	</option_data>
	<option_data id="36699">
		<!--Received damage -1%-->
	</option_data>
</list>