<?xml version="1.0" encoding="UTF-8"?>
<!DOCTYPE list SYSTEM "option_data.dtd">
<list>
	<option_data id="16163">
		<skills>
			<skill id="3203" level="1"/> <!--Item Skill: Mystery Skill-->
		</skills>
	</option_data>
	<option_data id="16164">
		<skills>
			<skill id="3143" level="10"/> <!--Item Skill: Kiss of Eva-->
		</skills>
	</option_data>
	<option_data id="16165">
		<skills>
			<skill id="3144" level="10"/> <!--Item Skill: Acrobatics-->
		</skills>
	</option_data>
	<option_data id="16166">
		<skills>
			<skill id="3145" level="10"/> <!--Item Skill: Iron Body-->
		</skills>
	</option_data>
	<option_data id="16167">
		<skills>
			<skill id="3156" level="1"/> <!--Item Skill: Firework-->
		</skills>
	</option_data>
	<option_data id="16168">
		<skills>
			<skill id="3206" level="1"/> <!--Item Skill: Music-->
		</skills>
	</option_data>
	<option_data id="16169">
		<skills>
			<skill id="3157" level="1"/> <!--Item Skill: Large Firework-->
		</skills>
	</option_data>
	<option_data id="16170">
		<triggers>
			<trigger id="3081" level="10" type="ATTACK" chance="1.0"/> <!--Item Skill: Charm-->
		</triggers>
	</option_data>
	<option_data id="16171">
		<triggers>
			<trigger id="3080" level="10" type="ATTACK" chance="1.0"/> <!--Item Skill: Aggression-->
		</triggers>
	</option_data>
	<option_data id="16172">
		<triggers>
			<trigger id="3083" level="10" type="ATTACK" chance="1.0"/> <!--Item Skill: Slow-->
		</triggers>
	</option_data>
	<option_data id="16173">
		<triggers>
			<trigger id="3109" level="10" type="CRIT" chance="5.0"/> <!--Item Skill: Aggression Down-->
		</triggers>
	</option_data>
	<option_data id="16174">
		<triggers>
			<trigger id="3108" level="10" type="CRIT" chance="5.0"/> <!--Item Skill: Aggression Up-->
		</triggers>
	</option_data>
	<option_data id="16175">
		<triggers>
			<trigger id="3111" level="10" type="CRIT" chance="5.0"/> <!--Item Skill: Slow-->
		</triggers>
	</option_data>
	<option_data id="16176">
		<triggers>
			<trigger id="3096" level="10" type="OFFENSIVE_MAGICAL_SKILL_USE" chance="2.0"/> <!--Item Skill: Slow-->
		</triggers>
	</option_data>
	<option_data id="16177">
		<skills>
			<skill id="3252" level="10"/> <!--Item Skill: Kiss of Eva-->
		</skills>
	</option_data>
	<option_data id="16178">
		<skills>
			<skill id="3253" level="10"/> <!--Item Skill: Acrobatics-->
		</skills>
	</option_data>
	<option_data id="16179">
		<skills>
			<skill id="3254" level="10"/> <!--Item Skill: Iron Body-->
		</skills>
	</option_data>
	<option_data id="16180">
		<skills>
			<skill id="3188" level="10"/> <!--Item Skill: Winter-->
		</skills>
	</option_data>
	<option_data id="16181">
		<skills>
			<skill id="3139" level="10"/> <!--Item Skill: Agility-->
		</skills>
	</option_data>
	<option_data id="16182">
		<skills>
			<skill id="3196" level="10"/> <!--Item Skill: Bleed-->
		</skills>
	</option_data>
	<option_data id="16183">
		<skills>
			<skill id="3130" level="10"/> <!--Item Skill: Ritual-->
		</skills>
	</option_data>
	<option_data id="16184">
		<skills>
			<skill id="3169" level="10"/> <!--Item Skill: Stone-->
		</skills>
	</option_data>
	<option_data id="16185">
		<skills>
			<skill id="3194" level="10"/> <!--Item Skill: Fear-->
		</skills>
	</option_data>
	<option_data id="16186">
		<skills>
			<skill id="3165" level="10"/> <!--Item Skill: Prominence-->
		</skills>
	</option_data>
	<option_data id="16187">
		<skills>
			<skill id="3151" level="10"/> <!--Item Skill: Peace-->
		</skills>
	</option_data>
	<option_data id="16188">
		<skills>
			<skill id="3150" level="10"/> <!--Item Skill: Charm-->
		</skills>
	</option_data>
	<option_data id="16189">
		<skills>
			<skill id="3149" level="10"/> <!--Item Skill: Aggression-->
		</skills>
	</option_data>
	<option_data id="16190">
		<skills>
			<skill id="3140" level="10"/> <!--Item Skill: Guidance-->
		</skills>
	</option_data>
	<option_data id="16191">
		<skills>
			<skill id="3190" level="10"/> <!--Item Skill: Hold-->
		</skills>
	</option_data>
	<option_data id="16192">
		<skills>
			<skill id="3170" level="10"/> <!--Item Skill: Solar Flare-->
		</skills>
	</option_data>
	<option_data id="16193">
		<skills>
			<skill id="3138" level="10"/> <!--Item Skill: Heal Empower-->
		</skills>
	</option_data>
	<option_data id="16194">
		<skills>
			<skill id="3126" level="10"/> <!--Item Skill: Prayer-->
		</skills>
	</option_data>
	<option_data id="16195">
		<skills>
			<skill id="3123" level="10"/> <!--Item Skill: Heal-->
		</skills>
	</option_data>
	<option_data id="16196">
		<skills>
			<skill id="3133" level="10"/> <!--Item Skill: Empower-->
		</skills>
	</option_data>
	<option_data id="16197">
		<skills>
			<skill id="3131" level="10"/> <!--Item Skill: Cheer-->
		</skills>
	</option_data>
	<option_data id="16198">
		<skills>
			<skill id="3125" level="10"/> <!--Item Skill: Battle Roar-->
		</skills>
	</option_data>
	<option_data id="16199">
		<skills>
			<skill id="3124" level="10"/> <!--Item Skill: Blessed Body-->
		</skills>
	</option_data>
</list>