<?xml version="1.0" encoding="UTF-8"?>
<!DOCTYPE list SYSTEM "option_data.dtd">
<list>
	<option_data id="23247">
		<for>
			<add order="0x60" stat="pDef" value="41.835"/>
		</for>
	</option_data>
	<option_data id="23248">
		<for>
			<add order="0x60" stat="mDef" value="35.478"/>
		</for>
	</option_data>
	<option_data id="23249">
		<for>
			<add order="0x60" stat="maxHp" value="154.019"/>
		</for>
	</option_data>
	<option_data id="23250">
		<for>
			<add order="0x60" stat="maxMp" value="50.572"/>
		</for>
	</option_data>
	<option_data id="23251">
		<for>
			<add order="0x60" stat="maxCp" value="277.234"/>
		</for>
	</option_data>
	<option_data id="23252">
		<for>
			<add order="0x60" stat="pAtk" value="28.526"/>
		</for>
	</option_data>
	<option_data id="23253">
		<for>
			<add order="0x60" stat="mAtk" value="35.875"/>
		</for>
	</option_data>
	<option_data id="23254">
		<for>
			<add order="0x60" stat="regHp" value="0.672"/>
		</for>
	</option_data>
	<option_data id="23255">
		<for>
			<add order="0x60" stat="regMp" value="0.283"/>
		</for>
	</option_data>
	<option_data id="23256">
		<for>
			<add order="0x60" stat="regCp" value="0.672"/>
		</for>
	</option_data>
	<option_data id="23257">
		<for>
			<add order="0x60" stat="pEvasRate" value="3.389"/>
		</for>
	</option_data>
	<option_data id="23258">
		<for>
			<add order="0x60" stat="pAccCombat" value="3.389"/>
		</for>
	</option_data>
	<option_data id="23259">
		<for>
			<add order="0x60" stat="basePCritRate" value="25.52"/>
		</for>
	</option_data>
	<option_data id="23260">
		<for>
			<add order="0x60" stat="pDef" value="21.639"/>
			<add order="0x60" stat="mDef" value="17.127"/>
		</for>
	</option_data>
	<option_data id="23261">
		<for>
			<add order="0x60" stat="pDef" value="21.639"/>
			<add order="0x60" stat="maxHp" value="74.354"/>
		</for>
	</option_data>
	<option_data id="23262">
		<for>
			<add order="0x60" stat="pDef" value="21.639"/>
			<add order="0x60" stat="maxMp" value="24.414"/>
		</for>
	</option_data>
	<option_data id="23263">
		<for>
			<add order="0x60" stat="pDef" value="21.639"/>
			<add order="0x60" stat="maxCp" value="133.837"/>
		</for>
	</option_data>
	<option_data id="23264">
		<for>
			<add order="0x60" stat="pDef" value="21.639"/>
			<add order="0x60" stat="pAtk" value="13.771"/>
		</for>
	</option_data>
	<option_data id="23265">
		<for>
			<add order="0x60" stat="pDef" value="21.639"/>
			<add order="0x60" stat="mAtk" value="17.319"/>
		</for>
	</option_data>
	<option_data id="23266">
		<for>
			<add order="0x60" stat="pDef" value="21.639"/>
			<add order="0x60" stat="regHp" value="0.324"/>
		</for>
	</option_data>
	<option_data id="23267">
		<for>
			<add order="0x60" stat="pDef" value="21.639"/>
			<add order="0x60" stat="regMp" value="0.137"/>
		</for>
	</option_data>
	<option_data id="23268">
		<for>
			<add order="0x60" stat="pDef" value="21.639"/>
			<add order="0x60" stat="regCp" value="0.324"/>
		</for>
	</option_data>
	<option_data id="23269">
		<for>
			<add order="0x60" stat="pDef" value="21.639"/>
			<add order="0x60" stat="pEvasRate" value="1.636"/>
		</for>
	</option_data>
	<option_data id="23270">
		<for>
			<add order="0x60" stat="pDef" value="21.639"/>
			<add order="0x60" stat="pAccCombat" value="1.636"/>
		</for>
	</option_data>
	<option_data id="23271">
		<for>
			<add order="0x60" stat="pDef" value="21.639"/>
			<add order="0x60" stat="basePCritRate" value="12.32"/>
		</for>
	</option_data>
	<option_data id="23272">
		<for>
			<add order="0x60" stat="mDef" value="18.351"/>
			<add order="0x60" stat="maxHp" value="74.354"/>
		</for>
	</option_data>
	<option_data id="23273">
		<for>
			<add order="0x60" stat="mDef" value="18.351"/>
			<add order="0x60" stat="maxMp" value="24.414"/>
		</for>
	</option_data>
	<option_data id="23274">
		<for>
			<add order="0x60" stat="mDef" value="18.351"/>
			<add order="0x60" stat="maxCp" value="133.837"/>
		</for>
	</option_data>
	<option_data id="23275">
		<for>
			<add order="0x60" stat="mDef" value="18.351"/>
			<add order="0x60" stat="pAtk" value="13.771"/>
		</for>
	</option_data>
	<option_data id="23276">
		<for>
			<add order="0x60" stat="mDef" value="18.351"/>
			<add order="0x60" stat="mAtk" value="17.319"/>
		</for>
	</option_data>
	<option_data id="23277">
		<for>
			<add order="0x60" stat="mDef" value="18.351"/>
			<add order="0x60" stat="regHp" value="0.324"/>
		</for>
	</option_data>
	<option_data id="23278">
		<for>
			<add order="0x60" stat="mDef" value="18.351"/>
			<add order="0x60" stat="regMp" value="0.137"/>
		</for>
	</option_data>
	<option_data id="23279">
		<for>
			<add order="0x60" stat="mDef" value="18.351"/>
			<add order="0x60" stat="regCp" value="0.324"/>
		</for>
	</option_data>
	<option_data id="23280">
		<for>
			<add order="0x60" stat="mDef" value="18.351"/>
			<add order="0x60" stat="pEvasRate" value="1.636"/>
		</for>
	</option_data>
	<option_data id="23281">
		<for>
			<add order="0x60" stat="mDef" value="18.351"/>
			<add order="0x60" stat="pAccCombat" value="1.636"/>
		</for>
	</option_data>
	<option_data id="23282">
		<for>
			<add order="0x60" stat="mDef" value="18.351"/>
			<add order="0x60" stat="basePCritRate" value="12.32"/>
		</for>
	</option_data>
	<option_data id="23283">
		<for>
			<add order="0x60" stat="maxHp" value="79.665"/>
			<add order="0x60" stat="maxMp" value="24.414"/>
		</for>
	</option_data>
	<option_data id="23284">
		<for>
			<add order="0x60" stat="maxHp" value="79.665"/>
			<add order="0x60" stat="maxCp" value="133.837"/>
		</for>
	</option_data>
	<option_data id="23285">
		<for>
			<add order="0x60" stat="maxHp" value="79.665"/>
			<add order="0x60" stat="pAtk" value="13.771"/>
		</for>
	</option_data>
	<option_data id="23286">
		<for>
			<add order="0x60" stat="maxHp" value="79.665"/>
			<add order="0x60" stat="mAtk" value="17.319"/>
		</for>
	</option_data>
	<option_data id="23287">
		<for>
			<add order="0x60" stat="maxHp" value="79.665"/>
			<add order="0x60" stat="regHp" value="0.324"/>
		</for>
	</option_data>
	<option_data id="23288">
		<for>
			<add order="0x60" stat="maxHp" value="79.665"/>
			<add order="0x60" stat="regMp" value="0.137"/>
		</for>
	</option_data>
	<option_data id="23289">
		<for>
			<add order="0x60" stat="maxHp" value="79.665"/>
			<add order="0x60" stat="regCp" value="0.324"/>
		</for>
	</option_data>
	<option_data id="23290">
		<for>
			<add order="0x60" stat="maxHp" value="79.665"/>
			<add order="0x60" stat="pEvasRate" value="1.636"/>
		</for>
	</option_data>
	<option_data id="23291">
		<for>
			<add order="0x60" stat="maxHp" value="79.665"/>
			<add order="0x60" stat="pAccCombat" value="1.636"/>
		</for>
	</option_data>
	<option_data id="23292">
		<for>
			<add order="0x60" stat="maxHp" value="79.665"/>
			<add order="0x60" stat="basePCritRate" value="12.32"/>
		</for>
	</option_data>
	<option_data id="23293">
		<for>
			<add order="0x60" stat="maxMp" value="26.158"/>
			<add order="0x60" stat="maxCp" value="133.837"/>
		</for>
	</option_data>
	<option_data id="23294">
		<for>
			<add order="0x60" stat="maxMp" value="26.158"/>
			<add order="0x60" stat="pAtk" value="13.771"/>
		</for>
	</option_data>
	<option_data id="23295">
		<for>
			<add order="0x60" stat="maxMp" value="26.158"/>
			<add order="0x60" stat="mAtk" value="17.319"/>
		</for>
	</option_data>
	<option_data id="23296">
		<for>
			<add order="0x60" stat="maxMp" value="26.158"/>
			<add order="0x60" stat="regHp" value="0.324"/>
		</for>
	</option_data>
	<option_data id="23297">
		<for>
			<add order="0x60" stat="maxMp" value="26.158"/>
			<add order="0x60" stat="regMp" value="0.137"/>
		</for>
	</option_data>
	<option_data id="23298">
		<for>
			<add order="0x60" stat="maxMp" value="26.158"/>
			<add order="0x60" stat="regCp" value="0.324"/>
		</for>
	</option_data>
	<option_data id="23299">
		<for>
			<add order="0x60" stat="maxMp" value="26.158"/>
			<add order="0x60" stat="pEvasRate" value="1.636"/>
		</for>
	</option_data>
</list>